{
  "$schema": "https://json-schema.org/draft/2020-12/schema",
  "$id": "https://ebi-webcomponents.github.io/protvista/schema/v1/feature-record.schema.json",
  "title": "ProtVista feature record",
  "description": "The feature record your own CSV, TSV, JSON or BED file decodes to, and the feature tracks consume. CSV/TSV/JSON records keep every extra column or key (for dataTooltip) except tooltipContent, locations, residuesToHighlight and Object.prototype names; BED records carry only the canonical fields. Generic format only — domain-adapter (EBI API) payloads are not schematised. See docs/adapter-reference.md.",
  "type": "object",
  "required": [
    "type",
    "start",
    "end"
  ],
  "additionalProperties": true,
  "properties": {
    "type": {
      "type": "string",
      "description": "Feature category label (e.g. DOMAIN, BINDING). Drives `filter:` and colour grouping."
    },
    "start": {
      "type": "integer",
      "description": "1-based start position (inclusive).",
      "$comment": "JSON sources also accept `begin` as an alias for `start`; `start` wins when both are present."
    },
    "end": {
      "type": "integer",
      "description": "1-based end position (inclusive). Must not be less than `start`."
    },
    "description": {
      "type": "string",
      "description": "Free text shown in the default tooltip. Omitted when empty."
    },
    "score": {
      "type": "number",
      "description": "Optional numeric score. Omitted when empty."
    },
    "color": {
      "type": "string",
      "description": "Per-feature colour (any CSS colour) for the outline, and the fill unless `fill` is set; wins over the track's `rendering.color`. CSV/TSV/JSON only — BED never sets it. Omitted when empty."
    },
    "shape": {
      "type": "string",
      "description": "Per-feature glyph (see the type and shape vocabulary); wins over the track's `rendering.shape`. CSV/TSV/JSON only. Omitted when empty."
    },
    "fill": {
      "type": "string",
      "description": "Per-feature fill colour; defaults to `color`. CSV/TSV/JSON only. Omitted when empty."
    },
    "opacity": {
      "type": "number",
      "description": "Per-feature opacity, from 0 to 1 (the canvas default is 0.9). CSV/TSV/JSON only. Omitted when empty; any other value is an error."
    }
  }
}
